"আমি ত্রিকব্দ ওয়েবসাইট এ পোস্ট করলে অপ্প্রভ হয় না কেন",
"মুভি দেখতে হবে",
"আপনি লেখক না তাই",
"হারিয়ে যেতে চাই",
"দিনকাল ভালো যাচ্ছে না",
"পোস্টি ভালো করে দেখেসেহন তো ?",
"খুব ভালো কাজ করেছেন ভাইয়া",
"যদি আরো মুভি লাগে তাহলে কমেন্ট করে জানান",
"আপনার পছন্দের কোনো মুভি থাকলে আমাকে জানান",
"আমি শেয়ার করার চেষ্টা করবো",
"পরবর্তী পোস্ট এ আপনার সাজেস্ট করা মুভি দেওয়ার চেষ্টা করবো",
"ক্ষমা করবেন আমার সঠিক জানা নাই",
"অবস্যই দিবো ভাই",
"ঝামেলা নাই",
"ধন্যবাদ , পরবর্তী পোস্ট এ পেয়ে যাবেন",
"সাকিব খান এর বির মুভি",
"চেষ্টা করবো ভাই সাথে থাকুন",
"থাকলে দিতে পারেন",
"দেওয়ার চেষ্টা করবো ভাই সাথে থাকুন",
"নেক্সট পোস্ট এ পেয়ে যাবেন",
"একটি ডাক্তারি বুক থেকে এই তত্থ পাওয়া",
"ডাউনলোড লিংক যেতে হাজার তা পেচাল করতে হয়",
"পেয়ে যাবেন ভাই",
"নেক্সট পোস্ট এ পেয়ে যাবেন",
"লিংক এ গেলেই ডাউনলোড অপসন পাবেন ভাই",
"সব মুভি তো ইউটুবে এ পাওয়া যায়না",
"ইটা বিনোদনের জায়গা",
"যেই গল্প শুনি",
"চেষ্টা করবো ভাই",
"খুব কাজের পোস্ট. চালিয়ে যান",
"প্রশংসার জন্য ধন্যবাদ আপনাকে",
"লিনাক্স সফটওয়্যার তো",
"ক্যারেক্টার নষ্টের মুভি নয়",
"আসেন আমরা ইসলাম প্রচার করি",
"চার নম্বর নাটকটি ভুল তথ্য দেয়া হয়েছে",
"কেমনে একটু বলবেন এইজ করিনি শুধু দেখেই গেলাম",
"ফাইল গুলোকে কি করবো বলেন ভাই",
"ভাই কোনো ভিডিও থাকলে দেন নাহলে বলেন প্লিজ",
"সব গুলা এপিসোড দিসেন",
"হুম সব গুলা আছে",
"অসাধারণ পোস্ট",
"ভাই লিংক ঠিক আছে, ডাউনলোড হয় না",
"লিংক ঠিক আছে ভাই",
"প্রতি উইক যে একটি করে মুভি নিয়ে আসবেন",
"ভাই আপনি চেষ্টা করে দেখুন, হয় না",
"একলহান থেকে আপনি ডাউনলোড করে নিন",
"শেষে বিজয় তা কার হবে",
"অসাধারণ একটা মুভি",
"খুব যে অবাক হলাম",
"ভালো পোস্ট",
"ধন্যবাদ আপনার মূল্যবান মন্তব্য করার জন্য",
"আমার টানা ১৩ দিন জেগে থাকার রেকর্ড দেখবেন কি ?",
"সন্নবাদ এইরকম পোস্ট আমাদের সাথে শেয়ার করার জন্য",
"লেখাটা জোস্স্ হইসে",
"সন্নাদ ভাই সাথেই থাকুন",
"ধন্যবাদ ত্রিকব্দ কমেন্টার ভাই",
"ডাউনলোড লিংক কৈ",
"পোস্ট এর নিচে দেখেন ভাই , পোস্ট তা তো ভালো করে পড়ে দেখবেন নাকি ?",
"সমস্যা হলে কমেন্ট করুন",
"সেরা থ্রিলার মুভি রিভিউ চাই",
"ভাই পোস্ট না পড়েই ধন্যবাদ ভাই",
"ভাই ইটা বলেন যে",
"দাব্বে দিয়ে শুরু করতে পারেন ভাই",
"ভাই আপনার কাছে আরেকটু রিকোয়েস্ট প্লিজ",
"সাথেই থাকুন ভাই",
"ভাই প্লিজ দাব্বে এর লিংক দেন",
"হররর মুভি যদিও দেখিনা তবুও ধন্যবাদ",
"গুগল ড্রাইভ ডাউনলোড লিংক",
"ভাই এসব কি শেয়ার করেন",
"গুনাহ হবে আপনি কি ধরনের জিনিস দেখছেন",
"আমি আজ ২ন্ড পর্ব দেখলাম , ভালো লগলো",
"৩র্ড পর্ব টিও দেখার রিকোয়েস্ট করা হলো",
"ধন্যবাদ আপনাকে",
"যার যেটা ভালো লাগে",
"সবটা জানতে গুগল এ সার্চ করতে পারেন",
"আপনার ক্রিয়েটিভ লিখা অসাধারণ",
"ওই মিয়া কপি পিস্ট কোর্সে কে ?",
"কার নম্বর ড্রামাতে ইন্টার৩য়েস্টেড আমি ভাই",
"ম্যাডাম যেমনটা বললো",
"আমি কাহিনিটা আরো আগে থেকেই জানতাম",
"প্রথম প্রথম ইন্টারনেট এর গুজবের ব্যাপার তো আছেই",
"আপনার কমেন্ট পড়ে কিছু বুঝলাম না",
"ইটা কিন্তু বাস্তব নৌ",
"আপনিও লিখতে পুনুরায় ভালো করে পড়ুন",
"ঠিক আছে",
"মুভিটা ভালো",
"সাইট এখন একদম ঠিক আছে",
"আগেই দেখেছি",
"আমার সাইট এ দেয়া আছে ভাই",
"নতুন নতুন ভালো ভালো পোস্ট",
"কি বলতে চাচ্ছেন",
"ভাই বোধহয় প্রথম ওয়েবসাইট খুলেছেন",
"মুভি তো ডাউনলোড লিংক নাই ঐখানে",
"সরি পেয়েছি",
"সুন্দর কমেন্ট করার জন্য ধন্যবাদ",
"ভাই আমি স্লিপ নম্বর হারিয়ে ফেলেছি",
"নির্বাচন অফিসার এর ক্যালয়ে আবেদন করুন",
"সেদিন করে এতো বুঝাইলাম",
"অন্ন এত করে বলার পরেও এতটুকু সম্মান দিতে পারলেন না",
"ও তো মনে হয় হিন্দু",
"ঈদ পোস্ট করা হয়েছে",
"ঈদ নম্বর পেতো না",
"দুইটা কার্ড অনলাইন কপি বের কোরেসিলাম",
"চুপ করে পোস্ট পরে",
"পোস্ট করার শক্তি খুঁজে পাই",
"প্রব্লেম দেখাইতাসে ভাই",
"আপনার কমেন্ট এর জন্য আপনাকেও ধন্যবাদ",
"আপনার ঈদ নম্বর",
"ফেইসবুক ঈদ ভেরিফাই করা যাবে?",
"পোস্ট এ দেখানো ফরমেট ম্যাসেজ করুন",
"মে বা না. চেষ্টা করে দেখুন যায় কি না",
"সঠিক বলতে পারছি না",
"যেকোনো সরকারি বেসরকারি কাজে উসে করতে পারবে",
"আপনি এর আগে ঈদ কার্ড পেয়েছিলেন ?",
"আমার এইজ ১৮+ হয়ে গেছে",
"ঈদ এর জন্য কোনো কাজ করিনি",
"কাজ হতে পারে",
"মুভি তা কয়েকবার এ দেখলাম মুভি দারুন হয়েছে",
"অসংখ ধন্যবাদ কমেন্ট করে আমাদের কে জানানোর জন্য",
"হতো পুরো বাংলাদেশ এর মতো লাগতো",
"আপনার কথা ঠিক ইটা ইন্ডিয়ার চালাকি",
"সে মুভিতে কাজ করতে রাজি আছে",
"বাংলাদেশ কে ঠিক ভাবে দেখানো হবে",
"জি আপনার আশা পূর্ণ হোক",
"নেটফ্লিক্স আপ্প ডাউনলোড করুন",
"লিখা ছিলো হাসিনা পরিবহন",
"ভাইয়ারা এই সিনেমার ডাউনলোড লিংক কেউ দিতে পারবেন ?",
"আপনি ইমেইল করুন ধন্যবাদ",
"যারা এসব থেকে দূরে থাকতে চায়",
"কেন যে এই মুভি বানাইসে আল্লাহ জানে",
"আমার নিজের বেক্তিগত মতামত বলছি",
"যেইটা আমরা বন্ধ করতে পারি সেটা এড়িয়ে যাওয়া দরকার কি !",
"এনি আছে সাি প্রমোট নিয়ে",
"ট্রেইলার দেখে মনেহইছিলো সুন্দর একটা মুভি পেতে যাচ্ছি",
"ট্রেইলার দেখে মনেহইছিলো সুন্দর একটা মুভি পেতে যাচ্ছি",
"ভালো প্রিন্ট এখনো আসে নাই",
"পোস্ট এর ছবি দেখেই রোজা শেষ",
"ভাই তাহলে এসব থেকে দূরে থাকাই ভালো আপনার",
"আপনি হয়তো জানেন না যে মুসলিম দের নাটক/সিনেমা দেখা হারাম",
"দূরেই থাকে",
"কোথায় ক্লিক করলে ডাউনলোড হবে বলবেন একটু?",
"ভালো করে পোস্ট তা পড়ুন",
"ফাত্রামি থেকেই যায় তাই রিপোর্ট",
"নাচতে না জানলে উঠান বাঁকা",
"এরোকোন লিংক দেয়া থেকে বিরত থাকুন",
"ভাই আমার ফর্ম নম্বর",
"এটা দিয়েই চেষ্টা করে দেখেন",
"১৮ বছর না হলে কি বের করা যাবে",
"জি, ১৮ না হলেও বের করা যাবে",
"১০ ডিজিটস নম্বর দিয়ে তো রেজিস্ট্রেশন করা যায়না",
"কে বলছে যায়না? আপনি চেষ্টা করে দেখেছেন?",
"আমি তো ১০ সংখ্যাটা দিয়েই করলাম",
"তত্থ পরিবর্তন বলতে",
"আমি কি আমার ছবি পরিবর্তন করতে পারব",
"এর জন্য কি কি করতে হবে?",
"ওয়েবসাইট এ ঢুকতে পারছি না",
"আপনি পোস্ট করার আরো আগেই আমি বের করছি",
"পুরাতন ভোটার রা দেখতে পারবে না?",
"সব জায়গায় দেখতে ভালোমন্দ আছে",
"আপনি পোস্ট করার আরো আগেই আমি বের করছি",
"পুরাতন ভোটার রা দেখতে পারবে না?",
"নকল কপি এর জন্য আবেদন করতে বলে ডাউনলোড গেলে",
"এই রকম নমুনা আসে না",
"এখন আবার চেষ্টা করুন",
"সাইট এ জয়েনও করে তাড়াতাড়ি জয়েনও করে ফেলুন",
"স্প্যাম করা থেকে বিরত থাকুন",
"সব ঠিক ভাবে হয়েছে",
"আমরাও এরকম আসে",
"সব যে ঠিক চে ভাই . কিন্তু আপনার ডাউনলোড তথ্যা ফাঁকে",
"নোটিফিকেশন বার এ টাইম এর গরমিল আছে",
"হা.নতুন করে রেজিস্ট্রেশন করুন",
"কপি ডাউনলোড হয় না কেন ?",
"কি প্রবলেম ফেস করেছেন?",
"আর যারা পুরাতন,ঈদ কার্ড পাইসেন.তাদের কে নতুন করে আবেদন করতে হবে.",
"জি আপনি সঠিক",
"ইটা ঠিক করেন নাই আপনি",
"জীবনটাই ছেলে খেলা ভাই",
