"কমিটমেন্ট মুভি তও জোস্স্",
"১০০% কার্য কোর্ নাইস পোস্ট",
"",
"৩ নম্বর পার্ট পরে কিসু বুজেঁ নাই!!!",
"৩র্ড এপিসোড কবে আসবে?",
"৪৮০প এর সাইজও কত",
"৫-১৫",
"৫-বারমুডা ট্রায়াঙ্গল",
"কপি করা",
"অনেক অনেক ধন্যবাদ ডাইরেক্ট লিংক দেয়ার জন্য",
"অনেক বড় হয়ে গেছে তাই দেয়নি . পরের পর্বটাতে দিব ইনশাআল্লাহ",
"অনেক সুন্দর ভাইয়া",
"অনেক সুন্দর হইসে ভাই",
"বাইট করেন কয়েক আওয়ার্স নাহলে উপ্ত ২৪ আওয়ার্স",
"অসংখ ধন্যবাদ অনুপ্রেরণার জন্য",
"অসংখ ধন্যবাদ আপনাকে",
"অসাধারন টিপস ভাই",
"এপলাই করা জাস্সে না কেন??",
"ঈদ তে ফলোয়ার বাড়ানোর ট্রিক দেন",
"আগের মতো আবার পোস্ট করা শুরু করবেন",
"অক্কা আমি কমেন্ট করতে পারি না কেন",
"আপনাকেও অন্তরের অন্তঃস্থল থেকে ধন্যবাদ",
"আপনার কথাটা ঠিক বুঝতে পারলাম না ভাইয়া",
"আপনি কি ডাক্তার?",
"আপনার পোস্ট দেখি নাই…",
"আপনিও এপলাই করে ফেলেছেন",
"",
"আমার তো ভাই তিক্তক রিলেটেড কোনো পোস্ট করার কথা ছিলো না ভাই",
"আমার নাই ভাই",
"আমার টাইটেল কপি করলেন??",
"আমি তো পোস্ট দেওয়ার আগেই ডেকসি",
"আমিও পাই তবে সর্ব সাধারণের জন্য গুগল ড্রাইভ লিংক এই ভালো",
"আমি রেলেসে এর কয়েক হওয়ার পরেই ডেকসি",
"আমি রেলেসে এর কয়েক হওয়ার পরেই পোস্ট ডিসি",
"",
"ইংলিশ কনটেন্ট গুগল থেকে বাংলা ট্রান্সলেট করে পেস্ট করে দিচ্ছেন",
"এই সাইট ইউটুবে সুস্ক্রিব ড্রপ করে অনেক র অন্ন গুলো সংে অনেক ড্রপ করে র কাও পয়েন্ট নিতে চাইলে বলবে ১৫ টক পের্ ক পয়েন্ট সেল দিবো পয়েন্টস",
"এই লাইক ড্রপ করে.. স টাইম ওয়াস্তে",
"এগুলা সদ্দো রিলিজ",
"একদম লাস্ট যে যেটা হইসে.",
"এখন মোটা হৈসেন?",
"এটা কি যে কোনো জেলা থেকে এপলাই করা যাবে???",
"ইটা কি বিক্রয় ডট কম",
"ফব ২টি ফ্যাক্টর সমস পিএসসি না সিম ও বয়সে…কি করবো…হেল্প…লগইন হাসে না",
"ঐটা এখনো রানিং",
"বরকত করে নিজেকে অনেক তিরেদ করেন, যাতে আগে ঘুম আসতে বাধ্য হয়",
"ওওও আচ্ছা আমি আমার দুই ঈদ দিয়ে লাইক ডিসি",
"কি দেখায়",
"কি ভাই ? এতদিন যে জেনে এসেছি লেবুতে সাইট্রিক এসিড থাকে",
"",
"কিছু বানান ভুল এসে ব্রো লেখার টাইম এ খেয়াল করবেন",
"কিন্তু টাইটেল রং ই বুঝাইসেন",
"কিন্তু ভাই তরমুজ এর যে দাম, তাতে চাষ করে খাওয়া ছাড়া উপায় নাই",
"কিভাবে?",
"কথা থেকে কপি করেন এগুলা !!",
"কোন ক্লাসে পড়েন?",
"ক্যাপশন তা ভালো মতো পরে নিবেন তারপর হাসবেন",
"ক্রেডিট দাউ",
"খুব ভালো",
"খুব ভালো হইসে.",
"খুব এডুকেটিভ পোস্ট. থাঙ্কস",
"খুব সুন্দর",
"খুব সুন্দর হইসে ভাই. থাঙ্কস",
"গুগল ড্রাইভ এ ডাউনলোডিং সিস্টেম তা দারুন",
"চমৎকার পোস্ট , চালিয়ে যান",
"চিনেসে",
"চালিয়ে য",
"ডন’ত বরি মই ব্রো,",
"জাজাকাল্লাহ খাইরান",
"কোপিয়েড ফ্রম জীবন সমস্যার সমাধান(সুমন সাহা)",
"জীবন সমস্যার সমাধান চ্যানেল থেকে",
"জোস্স্",
"টোরেন্টও থেকে দ্বনল্ড করতে পারেন",
"তিক্তক রেফার রিলেটেড সব পোস্ট ডিলেটেড, এইগুলা ত্রিকব্দ তে প্রহিবিটেড",
"ত্রিকব্দ কপি দর্স এখানে কিছু করার নেই..!",
"",
"ত্রিকব্দ এর সাপোর্ট টীম কে মেইল দেন.",
"ঠিক বলেসেন, আমি তাই কমেন্ট করে ফেলেসিলাম. কিন্তু ত্রিকব্দ’র যে এমন ভিসিটর আচে, যারা মানুষকে নির্দ্বিধাতে বিনা বাককে অমানুষ বলে ফেলতে পারে, তা এখন দখলাম.",
"ডাক্তার না হলে এগুলো জানেন কিভাবে",
"তেল একটু গরম করে লাগাবেন",
"তেল লাগালে চুল পড়ার পরিমাণ বেড়ে যায়",
"দেয়া ঠিক না",
"ধন্যবাদ",
"থাঙ্কস দারুন পোস্ট",
"থাঙ্কস ভাই",
"ধন্যবাদ ভাই,এরপর থেকে নিশ্চয় লক্ষ্য রাখবে",
"থ্যাংকস ভাইয়া সুন্দর কমেন্ট করার জন্য",
"ধন্যবাদ ভাইয়া",
"ধন্যবাদ",
"নঃ. তবে মাইন্ ক্যারেক্টার থাকবে.",
"না ভাই, বাসায় আসি,, হবো",
"না ভাই প্রিমিয়াম কিনতে হয়",
"নঃ,, কেন??",
"নিজেকে পরন থেকে বাঁচার জন্য বপন উসে করতে মানা করবেন",
"নো মার্সি মুভির কি হিন্দি ডুববেদ আচে??",
"ন্যাশনাল ঈদ নিচে তা আমি বেশ দেশি",
"ফুল পোস্ট কপি করা এই ভিডিও থেকে.",
"থ্যাংকস ফর টি পোস্ট",
"ফেইসবুক এ কানেক্ট হয়ে যাবে আপনার সাথে ?",
"বাংলা সুব্তিতলে এসে?",
"বাহ্!! ভালো লাগলো.",
"বা-৫০ ফোর্টে এন্ড ই-ক্যাপ",
"ভাই",
"ভাই আপনার আগেই পোস্ট তা কোরেশী দেখেন",
"ভাই আমরা ট্র্রেন্টগালাক্সি তে রিলিজ হওয়ার সাথেই পেয়ে যাই",
"ভাই আমার পিসি থেকে তো",
"ভি এটা কি ইনকগনিটো মোডেও কাজ করবে???",
"ভাই কত বছরের বাচ্চা দের কেত্রা তোমার ক্যান্সার সম্ববনা রয়েছে",
"ব্রথের কথা গুলো খুব এ মূল্যবান…",
"ভাই করলে খেয়ে এত উপকার হয় . আমি করলে তো খাইনা , তো এবার থেকে খাবো",
"ভাই ক্রেডিট তো ফাইল এর নামের সাথেই দেয়া আছে",
"ভাই সরি বুজতে পারি নাই",
"ভাই পুস্পা মুভি র হলে প্রিন্ট বের হইসে.. হ্দ প্রিন্ট আসলে শেয়ার করবো.",
"ভাই পুস্পা মুভি র গড্রিভা লিংক হবে?",
"ওরে ভাই পোস্ট এর টপিক দেখে আমি শিহরিত",
"ভাই বর্ণবাদ বন্ধ করেন",
"ভাই বাংলা সুব্তিতলে দিয়ে দেখতে পারেন..",
"বহায় ভয় দেখাইয়েন নঃ",
"ভাই রাম চরণ রাম মুভি তা হিন্দি করে দিবেন",
"ভাই সিরিজ তা একদম গ্রেট",
"ভাই, পুষ্টি ও উপকারিতা আছে বলেই পোস্ট করা হয়েছে",
"ভাই…লিংক এই তো ধোঁকা যাচ্চেন…কারো কাসে লিংক থাকলে দাও",
"ভাইয়া আপনি এর আগে যে ফটো কম্পেটিশন করসিল সেখানে কি জিটিসিলেন?",
"ভাই, অবসমে পোস্ট.",
"ভালো পোস্ট",
"ভালো লাগলো ভাই",
"ভালো লেকজেন স্যার",
"ভালো পোস্ট করেছেন বুট সবসময় এগুলা না দিয়ে কিছু টেক বেসড পোস্ট ওঃ দিতে পারেন",
"ভালো লাগসে",
"ভালো লাগলো",
"ঘাটাঘাটি করাটা বাদ দেন",
"ভালো লিখেসেন ফাহাদ স্যার !!",
"ভালোয় পোস্ট টি!",
"লাঙ্গুয়েজেস?",
"বপন উসে করলে কি আবার আইসা পর্ব নাকি??",
"বপন উসে করলে যদি এসে পড়ে তাইলে লাভ কি হইলো",
"টি ভিলাইনেস….এইটা কিবাবে মিস করলেন….অস্থির একটা মুভি",
"মাসাল্লাহ অনেক সুন্দর পোস্ট.",
"মত হইতে চাই তাহলে আমি কি করবো",
"যদি ঠিক না নেয় তাহলে কি কোনো প্রব্লেম হবে?",
"রেডমি নোট ৯ প্রো … এর জন্য এরকম ব্যান্ড এসে কি ব্রো?",
"লাইক না দিয়ে পারলাম না…",
"লিংক তা দিন",
"লিখতে ভুল হয়েছিল . ধন্যবাদ",
"লিংক কাজ করে না",
"অথর ভাইয়া আমার পোস্ট তা দেখেন",
"লাস্ট এর টিপস তা সেই কাজে দেয়! আমি এইটা আগে থেকেই করি",
"সঠিক কথা , অনেক বেড়ে গেছে দাম",
"সব জায়গায় এমজি উসে করবেন নঃ.",
"সব দেখা",
"দোনে",
"হেল্পফুল পোস্ট….চালিয়ে যান ভাই",
"সাইট এ ঢুকে না কেন??",
"সাইট এ প্রবেশ করতে পারছি না ব্রো…এখন কি করবো",
"সুন্দর",
"সুন্দর পোস্ট",
"স্বাগতম",
"hum apni thik bolechen.amio kom boyoser moddhe ekjon.sokale jokhon ami post er title dekhlam amio kharap post vebe eriyegecilam.but pore mone holo trickbd te tw kharap post deya nised tai porlam.",
"হুম্মম ভাইয়া",
"হুম,ধন্যবাদ",
"গেমস টি দয়া করে মদ শেয়ার করুন",
"ভাই সিন্ তিন আছে? রোজা রেখে দেখা যাবে ? এইটা দেখি নাই এখনো",
"এইটা দেখা যাবে",
"আবার জিজ্ঞাস করার মানে কি ?",
"এই আনিমে আমার অনেক ভালো লেগেছে",
"দেখা শুরু করি তাহলে",
"সেহ্রির সঠিক উচ্চারণ নাকি সাহরী হবে ?",
"ধন্যবাদ",
"খুব সুন্দর পোস্ট ভাই",
"ধন্যবাদ ভাইজান",
"দেখে ফেলতে পারেন",
"জিনিস তা সবারই একবার অন্তত দেখা উচিত",
"ঐটা ১০-টো এপিসোড দেখে ড্রপ ডিসি, আমার ভালো লাগে নাই",
"আফসোস ভাই ভালো একটা জিনিষ ড্রপ দিসেন",
"আমি কোবে দেখেই শেষ করে ফেলসি",
"করলেই এ নিয়ে জানবে",
"ভাই",
"আনিমে দেখি নাই",
"রোজায় কী ওজন বাড়ে? নাকি কমে",
"মাশাল্লাহ অনেক উপকারী পোস্ট",
"সাবাস বাংলাদেশ",
"আপনি কি মুসলিম নাকি হিন্দি নাকি কোনো ধর্মের ? একটু বলবেন ভাই",
"ধন্যবাদ জানানোর জন্য",
"এখানে সব বিষয় সম্পর্কে জানতে পারবেন , ধন্যবাদ",
"আপ্নে খান ?",
"শরীর ঠিক থাকলেই তো আপনি শিখতে পারবেন",
"একটা লিখা ও কপি না , প্রমাণ দিতে পারলে ত্রিকব্দ ছেড়ে যাবো, ধন্যবাদ",
"প্রিয় একটা খাবার",
"খুঁজলে পাবেন,সেবাসং ৫ প্রজন্ত আছে মনে হয়",
"বাংলা থাকলে দেন . ইংলিশ তো ইউটুবে এই আছে",
"৫৯% ডাউনলোড হওয়ার পর আর ডাউনলোড হচ্ছে না",
"পোস্ট আরো সুন্দর করে",
"কপি মুক্ত পোস্ট করা হয়েছে.সাজেশন দেয়ার জন্য ধন্যবাদ.",
"এই পোস্ট এ ভালোবাসা ওয়ার্ড ১৫ বার আছে",
"লেখা গুলা উল্টা পাল্টা",
"অনুবাদ করাটাই",
"বলের মতো কেন কথা বলেন ভাই",
"ধন্যবাদ প্রিয় ভাই",
"ওজন কমানোর টিপস দেন",
"বাহ্ ভাই খুব উপকারি পোস্ট",
"ধন্যবাদ",
"টাইটেল পড়ার পর বুঝলাম যে এই পোস্ট আমার জন্য না",
"ও ও , টাইটেল ভালো করে পড়া উচিত আপনার, ধন্যবাদ",
"হুম, পারলে ওজন বাড়ানোর পোস্ট দেন",
"চেষ্টা করবো,ধন্যবাদ",
"ঢাকায় এসেছি",
"আল্লাহ'র উপর ভরসা রাখুন ইন শা আল্লাহ ভালো হয়ে যাবে",
"সচেতনতা মূলক পোস্ট.ধন্যবাদ",
"ঐগুলা তো বুঝলাম কিন্তু যদি গোপন ক্যামেরা থাকে",
"ক্যামেরার সামনে কিছু দিয়ে দিবেন যাতে কিছু দেখা না যায়",
"ঢ়ৎপিন্ড প্রতিরোধ করে কথা তা বুঝলাম না ভাই",
"এডিট করা হয়েছে, ধন্যবাদ",
"ঢ়ৎপিন্ড প্রতিরোধ করে নাকি রিদ্রোগ প্রতিরোধ করে ?",
"আগেই এডিট করা হয়েছে,টাইপ এ ভুল ছিলো",
"আমি নিজেই আসক্ত,আর অন্যের কথা কি বলি ?",
"কম উসে করুন",
"৮ আওয়ার্স এতোক্ষন মোবাইল দিয়ে কি করেন",
"ফ্রি ফায়ার খেলি",
"এটাতো সময় নষ্টের মূল কারণ",
"যেইগুলা বেশি ইম্পর্ট্যান্ট সেইগুলা শুধু দিয়েছি, আপনি হুবহু মিল পাবেন না",
"শেষের তা ভালো লাগেনি",
"হুবহু মিল নাই",
"ধন্যবাদ সুন্দর পোস্ট করার জন্য",
"নন স্মোকার দের সংঙ্খা খুব যে কম",
"সঠিক বলেছেন ভাই",
"তোত্তোসূর্য কি ?",
"বিভিন্ন জায়গা থেকে ধারণা পাওয়া ও সঠিক তত্থ",
"আলহামদুল্লিলাহ, আমি ধূমপান করি না",
"ভালো লাগে না",
"খুব ভাল পোস্ট, অনেক উপকার হলো",
"অসংখ ধন্যবাদ",
"ইসলামিক দৃষ্টিতে ভিডিও গেম নিষিদ্ধ",
"হা ! তবে ইসলামিক দৃষ্টিতে তো অনেক কিছু নিষিদ্ধ, তবে ইটা কয়জন বা মানে",
"কোথায় ঘুরতে যাবেন ?",
"ভালো দিক যেমন আছে খারাপ দিক ও অনেক আছে",
"হা ! এখানে শুধু ভালো দিক তা তুলে ধরা হয়েছে",
"এরকম হাদিস আমি পাইনি",
"ধন্যবাদ ভাই",
"পোস্ট তা কি কোনো জায়গা থেকে সংগ্রহ করেছেন নাকি নিজে লিখছেন ?",
"একটু ক্লিয়ার করে নিবেন",
"নাম দেখে তো মুসলিম যে মনে হচ্ছে",
"ভুল কিছু বললে ক্ষমা করবেন ভাই",
"সবাই দেখবেন",
"একেবারে সুন্দর খাঁটি কয়েকটা কথা লিখেছেন",
"অসাধারণ",
"ধন্যবাদ",
"দরকারি পোস্ট ধন্যবাদ",
"আপনাকেও ধন্যবাদ",
"ধন্যবাদ",
"এই পোস্ট টি তো ফেইসবুক এ দেখেসিলাম",
"সেটা আমারই পোস্ট ছিল ভাই",
"করেছেন , ধন্যবাদ",
"নিশ্চয়ই অসংখ ধন্যবাদ আপনাকে",
"মুভি গুলো অবস্যই দেখবো",
"নিশ্চয়",
"বাংলা ডাবিং মুভি এর রিভিউ দেন",
"দারুন পোস্ট ভাইয়া",
"আমি জানি",
"থাকতেই পারে ব্রো, অনেক সুন্দর দেখতে",
"লিখে সার্চ করুন তাহলেই পেয়ে যাবেন",
"আল্লাহ'র নাম স্ক্যাম করেসেহান ? এতটা নিচে হয়েও ঠিক নয়",
"ম্যাডাম মুভি থেকে বের হয়ে কিছু দেন",
"দোয়া করবেন ইন শা আল্লাহ আসবে",
"মুভি সিরিজ বাদ দিয়ে অন্য দিকে লাইন ধরেন",
"চেষ্টায় আছি",
"এত্ত মুভি দিয়ে কি হবে অন্য কিছু থাকলে শেয়ার করুন",
"চেষ্টায় আছি",
"বড়ো মুভি লেভার আপনাকে",
"হুম বুঝলাম নাহ",
"অনেক ভালো লাগলো পোস্ট তা পরে",
"রিভিউ গুলা প্লট আর একটু বড়ো প্লট বুঝতে সুবিধা হয়",
"তুমি কি সত্যিই ভারতে থাকো ?",
"ভালো পোস্ট",
"পোড়োবার অপছন্দ, বন্ধুর গোপন কথা",
"আমাজন প্রাইম কিন্বা নাকি নেটফ্লিক্স ডাউনলোড করে দেখে নিন",
"আমি কপি পোস্ট করেছি",
"সরি ভাইয়া আসলে আমি বুঝতে পারি নাই",
"এই তো ডাইরেক্ট কপি পোস্ট",
"রিপোর্ট করুন",
"ওই সাইট তাই হচ্ছে কপি সাইট একটি",
"ওয়াটার বোতল মুভি এর লিংক প্রয়োজন",
"না ভাই , এখন খেলবো না রে",
"কসম আপু একটা ডিনার ও পাই নাই",
"কি বল্লি আমি বকবক করি তাই না",
"ভাইয়া আপনি ওই শয়তানের কোথায় একমত হয়ে বোলেছেন আমি বেশি কথা বলি",
"হা , ইন শা আল্লাহ থাকবো",
"কে গালি দিলো ?",
"ঐটা আর বলছি না ভাইয়া",
"ঢাকা এটাক দেখবো সময় করে",
"আপু ফ্রি ফায়ার খেলেন ?",
"না ভাইয়া",
"আপু ফব তে ফ্রেন্ড রিকোয়েস্ট পাঠাসি একসেপ্ট করেন",
"ভাই ইটা কি রিভিউ ছিলো ?",
"ঠিক আছে , চেষ্টা করবো",
"এইটাঃ কিভাবে রিভিউ হলো ??",
"এই মুভি তে সাউন্ড নাই",
"জি কিন্তু ইটা ছাড়া ইউটুবে এ অন্যতা খুঁজে পেলাম না ভাইয়া",
"দেখা আসে",
"যদি একটু বুঝিয়ে বলতেন",
"থ্রিলার মানে হচ্ছে রোমাঞ্চকর, আশা করি আপনার উত্তর পেয়েছেন ভাইয়া",
"ভিডিও দেখে ভাগ্গিশ ইউটুবে ভিডিও দেখেসিলাম",
"ঠিক বুঝলাম না ভাই নাটক রিভিউ করতে এসে প্রতারণা কোথায় ?",
"নেক্সট পর্বে থাকবে",
"সেরা নাটকের মধ্যে স্যার এর নাই নাই",
"নাটক আছে যা আপনার চোখে পড়ে নাই",
"চোখ দিয়ে পানি ঝরবে এমন নাটক তো দিলেন",
"অনেক আগেই দেখেছি",
"এই মুভি ৭ বার দেখছি",
"আবার হাসি চেপে রাখা যাবে না",
"পিকচার অনেক সুন্দর আগেই দেখেছি",
"আর হিন্দি তে দেখেন অনেক সুন্দর",
"পুরানো ছবি",
"দেখেছি অনেকবার",
"আমি অনেক ভালোবাসি",
"পুইরানো ছবি দেখতে ভালো লাগে",
"আচ্ছা ভাই",
"কল পেয়ে যাবেন ভাই",
"ভাই লিংক তো কাজ করছে না",
"এমন কোনো এড্রেস আছে আপনাদের কাছে",
"পোস্ট করা আছে ভাই",
"তাই নতুন নতুন হিন্দি তামিল মুভি পাওয়া যায় না",
"সব কিছু জানতে হবে",
"টেক রিলেটেড সাইট এ গল্প পোস্ট দেয়ার কি দরকার ভাই ?",
"কোনো ভুল হলে ছোট ভাই হিসেবে ক্ষমা করে দিয়েন",
