"কন ভুল হলে ছত ভাই হিশবে খমা করে দিয়েন",
"আমি তরিচকবদ ওএবসিতএ এ পসত করলে আপপরভে হয় না কেন",
"মভিএ দেখতে হবে",
"আপনি লেখক না তাই",
"হারিয়ে জেতে ছাই",
"দিঙ্কাল ভাল জাচ্ছে না",
"পসতি ভাল করে দেখেচেহন ত ?",
"খুব ভাল কাজ করেছেন ভাইয়া",
"জদি আর মভিএ লাগে তাহলে চমমেনত করে জানান",
"আপনার পছনদের কন মভিএ থাকলে আমাকে জানান",
"আমি শারে করার ছেসতা করব",
"পরবরতি পসত এ আপনার সুগগেসত করা মভিএ দাওয়ার ছেসতা করব",
"খমা করবেন আমার সথিক জানা নাই",
"অবঅসশঅই দিব ভাই",
"ঝামেলা নাই",
"ধননবাদ , পরবরতি পসত এ পেয়ে জাবেন",
"শাকিব খান এর বির মভিএ",
"ছেসতা করব ভাই সাথে থাকুন",
"থাকলে দিতে পারেন",
"দাওয়ার ছেসতা করব ভাই সাথে থাকুন",
"নেক্সত পসত এ পেয়ে জাবেন",
"একতি দাকতারি বওওক থেকে এই তত্থ পাওা",
"দওনলয়াদ লিঙ্ক জেতে হাযার তা পেছাল করতে হয়",
"পেয়ে জাবেন ভাই",
"নেক্সত পসত এ পেয়ে জাবেন",
"লিঙ্ক এ গেলেই দওনলয়াদ অপতিঅন পাবেন ভাই",
"শব মভিএ ত য়উতউবে এ পাওা জায়না",
"এতা বিনদনের জায়গা",
"জেই গলপ শুনি",
"ছেসতা করব ভাই",
"খুব কাজের পসত. ছালিয়ে জান",
"পরশংশার জনন ধননবাদ আপনাকে",
"লিনুক্স সফতওারে ত",
"ছারাচতের নশ্তের মভিএ নয়",
"আশেন আমরা ঈসলাম পরছার করি",
"ছার নুমবের নাতকতি ভুল ততত দেয়া হয়েছে",
"কেমনে একতু বলবেন আগে করিনি শুধু দেখেই গেলাম",
"ফিলে গুলকে কি করব বলেন ভাই",
"ভাই কন ভিদেও থাকলে দেন নাহলে বলেন পলেয়াসে",
"শব গুলা এপিসদএ দিসেন",
"হুম শব গুলা আছে",
"অশাধারঅন পসত",
"ভাই লিঙ্ক থিক আছে, ডওনলয়াদ হয় না",
"লিঙ্ক থিক আছে ভাই",
"পরতি ওীক এ একতি করে মভিএ নিয়ে আশবেন",
"ভাই আপনি ছেসতা করে দেখুন, হয় না",
"একলহান থেকে আপনি দওনলয়াদ করে নিন",
"সেশে বিজয় তা কার হবে",
"অশাধারঅন একতা মভিএ",
"খুব এ অবাক হলাম",
"ভাল পসত",
"ধননভাদ আপনার মুললবান মনতবব করার জনন",
"আমার তানা ১৩ দিন জেগে থাকার রেচরদ দেখবেন কি ?",
"ষননবাদ এইরকম পসত আমাদের সাথে শারে করার জনন",
"লেখাতা জসস হইসে",
"ষননয়াদ ভাই সাথেই থাকুন",
"ধননবাদ টরিচকবদ চমমেনতার ভাই",
"দওনলয়াদ লিঙ্ক কই",
"পসত এর নিছে দেখেন ভাই , পসত তা ত ভাল করে পরে দেখবেন নাকি ?",
"সমসশা হলে চমমেনত করুন",
"শেরা থ্রিললের মভিএ রেভিেও ছাই",
"ভাই পসত না পরেই ধননবাদ ভাই",
"ভাই এতা বলেন জে",
"দাববে দিয়ে সুরু করতে পারেন ভাই",
"ভাই আপনার কাছে আরেকতু রেকুেসত পলেয়াসে",
"সাথেই থাকুক ভাই",
"ভাই পলেয়াসে দাববে এর লিঙ্ক দেন",
"হররর মভিএ জওদিও দেখিনা তওবুও ধননবাদ",
"গওওগলে দরিভে দওনলয়াদ লিঙ্ক",
"ভাই এশব কি শারে করেন",
"গুনাহ হবে আপনি কি ধরনের জিনিশ দেখছেন",
"আমি আজ ২নদ পরব দেখলাম , ভাল আলগল",
"৩রদ পরব তিও দেখার রেকুেসত করা হল",
"ধননবাদ আপনাকে",
"জার জেতা ভাল লাগে",
"শবতা জানতে গওওগলে এ সেয়ারছ করতে পারেন",
"আপনার চরেয়াতিভে লিখা অশাধারঅন",
"অই মিয়া চপয় পেয়াসত করসে কে ?",
"কার নুমবের দরামাতে ইনতের৩েসতেদ আমি ভাই",
"মাদাম জেমনতা বলল",
"আমি কাহিনিতা আর আগে থেকেই জানতাম",
"পরথম পরথম ইনতেরনেত আর গুজবের বেপার ত আছেই",
"আপনার চমমেনত পরে কিছু বুঝলাম না",
"এতা কিনতু বাসতব নউ",
"আপনিও লিখতা পুনুরায় ভাল করে পরুন",
"থিক আছে",
"মভিএতা ভাল",
"সিতে এখন একদম থিক আছে",
"আগেই দেখেছি",
"আমার সিতে এ দেয়া আছে ভাই",
"নতুন নতুন ভাল ভাল পসত",
"কি বলতে ছাচ্ছেন",
"ভাই বদ্য় পরথম ওএবসিতএ খুলেছেন",
"মভিএ ত দওনলয়াদ লিঙ্ক নাই অইখানে",
"সররয় পেয়েছি",
"শুনদর চমমেনত করার জনন ধননবাদ",
"ভাই আমি সলিপ নুমবের হারিয়ে ফেলেছি",
"ণিরবাছন অফফিচের এর কাজালয়ে আবেদন করুন",
"সেদিন কারে এত বুঝাইলাম",
"অননঅ এত করে বলার পওরেও এততুকু সমমান দিতে পারলেন না তাদের",
"অ ত মনে হয় হিনদু",
"ঈড পসত করা হয়েছে",
"ঈড নুমবের পেত না",
"ডুইতা চারদ অনলিনে চপয় বের করেচিলম",
"ছুপ করে পসত পরে",
"পসত করার সকতি খুজে পাই",
"পরবলেম দেখাইতাসে ভাই",
"আপনার চমমেনত এর জনন আপনাকেও ধননবাদ",
"আপনার ইদ নুমবের",
"ফাচেবওওক ইদ ভেরিফয় করা জাবে?",
"পসত এ দেখান ফরমাত মাসসাগে করুন",
"মায় বে না. ছেশ্তা করে দেখুন জায় কি না",
"শথিক বলতে পারছি না",
"জেকন সরকারি বেসরকারি কাজে উসে করতে পারভে",
"আপনি এর আগে ইদ চারদ পেয়েছিলেন ?",
"আমার আগে ১৮+ হয়ে গেছে",
"ঈদ এর জনন কন কাজ করিনি",
"কাজ হওতেও পারে",
"মভিএ তা কয়েকবার এ দেখলাম মভিএ দারুন হয়েছে",
"অশঅংখঅ ধননবাদ চমমেনত করে আমাদের কে জানানর জনন",
"হত পুরা বাংলাদেশ এর মত লাগত",
"আপনার কথা থিক এতা ঈনদিয়ার ছালাকি",
"শে মভিএতএ কাজ করতে রাজি আছে",
"বাংলাদেশ কে থিক ভাবে দেখান হবে",
"জি আপনার আশা পুরন হক",
"নেতফলিক্স আপপ দওনলয়াদ করুন",
"লিখা ছিল হাসিনা পরিবহন",
"ভাইয়ারা এই চিনেমার দওনলয়াদ লিঙ্ক কেউ দিতে পারবেন ?",
"আপনি এমাইল করুন ধননবাদ",
"জারা এশব থেকে দুরে থাকতে ছায়",
"কেন জে এই মভিএ বানাইসে আললাহ জানে",
"আমার নিজের বেকতিগত মতামত বলছি",
"জেইতা আমরা বন্ধ করতে পারি সেইতা এরিয়এ জাওয়া দরকার কি !",
"এনি আছে সাই পরমত নিয়ে",
"টরাইলের দেখে মনেহইছইল শুনদর একতা মভিএ পেতে জাচ্ছি",
"থেকে দুরে থাকুন. ষেতাই ভাল হবে হয়ত. আর আমি অ ধুককিত",
"ভাল পরিনত এখন আশে নাই",
"পসত এর ছবি দেখেই রজা সেশ",
"ভাই তাহলে এশব থেকে দুরে থাকাই ভাল আপনার",
"আপনি হয়ত জানেন না জে মুসলিম দের নাতক/চিনেমা দেখা হারাম",
"দুরেই থাকে",
"কথায় চলিচক করলে দওনলয়াদ হবে বলবেন একতু?",
"ভাল করে পসত তা পরুন",
"ফাতরামি থেকেই জায় তাই রেপরত",
"নাছতে না জানলে উথান বাকা",
"এরকন লিঙ্ক দেয়া থেকে বিরত থাকুন",
"ভাই আমার ফরম নুমবের",
"এইতা দিয়েি ছেসতা করে দেখেন",
"১৮ বছর না হলে কি বের করা জাবে",
"জি, ১৮ না হওলেও বের করা জাবে",
"১০ দিগিতস নুমবের দিয়ে ত রেগিসতরাতিওন করা জায়না",
"কে বলছে জায়না? আপনি ছেসতা করে দেখেছেন?",
"আমি ত ১০ সংখারতা দিয়েি করলাম",
"তত্থ পরিবরতন বলতে",
"আমি কি আমার ছবি পরিবরতন করতে পারব",
"এর জনন কি কি করতে হবে?",
"ওএবসিতএ এ ধুকতে পারছি না",
"আপনি পসত করার আর আগেই আমি বের করছি",
"পুরাতন ভতের রা দেখতে পারবে না?",
"ষব জায়গায় দেখতে ভালমনদ আছে",
"আপনি পসত করার আর আগেই আমি বের করছি",
"পুরাতন ভতের রা দেখতে পারবে না?",
"ণকল চপয় এর জনন আবেদন করতে বলে দওনলয়াদ গেলে",
"এই রকম নমুনা আসে না",
"এখন আবার ছেসতা করুন",
"সিতে এ জইন করে তারাতারি জইন করে ফেলুন",
"সপাম করা থেকে বিরত থাকুন",
"শব থিক ভাবে হয়েছে",
"আমরাও এরকম আসে",
"ষব এ থিক ছে ভাই . কিনতু আপনার দওনলয়াদ তত্থতা ফাকে",
"নওতিফিচাতিওন বার এ তিমে এর গরমিল আছে",
"হা.ণতুন করে রেগিসতরাতিওন করুন",
"চপয় দওনলয়াদ হয় না কেন ?",
"কি পরবলেম ফাচে করেছেন?",
"আর জারা পুরাতন,িদ চারদ পাইসেন.তাদের কে নতুন করে আবেদন করতে হবে.",
"জি আপনি সথিক",
"এতা থিক করেন নাই আপনি",
"জিবনতাি ছেলে খেলা ভাই",
